{
  "$schema": "./TestStateSchema.json",
  "id": "123e4567-e89b-12d3-a456-426614174000",
  "ids": [
    "123e4567-e89b-12d3-a456-426614174000",
    "123e4567-e89b-12d3-a456-426614174001"
  ],
  "name": "test",
  "names": [
    "test1",
    "test2"
  ],
  "graphqlSchema": "type TestState {\n  id: ID!\n  ids: [ID!]!\n  name: String\n  names: [String]\n}\n"
}